{
  "$schema": "https://json-schema.org/draft/2020-12/schema",
  "$id": "https://epa.gov/comptox/schemas/exposureEvidenceSummary.v1.json",
  "title": "CompTox Exposure Evidence Summary v1",
  "description": "Portable summary of exposure and HTTK evidence retrieved from CompTox.",
  "type": "object",
  "additionalProperties": false,
  "required": [
    "chemicalRef",
    "cpdat",
    "seem",
    "httk",
    "mmdb",
    "qsurs",
    "provenance"
  ],
  "properties": {
    "chemicalRef": {
      "$ref": "#/$defs/chemicalRef"
    },
    "cpdat": {
      "oneOf": [
        {
          "$ref": "#/$defs/evidenceSlice"
        },
        {
          "type": "null"
        }
      ]
    },
    "seem": {
      "oneOf": [
        {
          "$ref": "#/$defs/evidenceSlice"
        },
        {
          "type": "null"
        }
      ]
    },
    "httk": {
      "oneOf": [
        {
          "$ref": "#/$defs/evidenceSlice"
        },
        {
          "type": "null"
        }
      ]
    },
    "mmdb": {
      "oneOf": [
        {
          "$ref": "#/$defs/evidenceSlice"
        },
        {
          "type": "null"
        }
      ]
    },
    "qsurs": {
      "oneOf": [
        {
          "$ref": "#/$defs/evidenceSlice"
        },
        {
          "type": "null"
        }
      ]
    },
    "provenance": {
      "$ref": "#/$defs/provenance"
    }
  },
  "$defs": {
    "chemicalRef": {
      "type": "object",
      "additionalProperties": false,
      "required": [
        "dtxsid",
        "preferredName"
      ],
      "properties": {
        "dtxsid": {
          "type": "string",
          "pattern": "^DTXSID[0-9A-Z]+$"
        },
        "preferredName": {
          "type": "string"
        },
        "casrn": {
          "type": [
            "string",
            "null"
          ]
        }
      }
    },
    "evidenceSlice": {
      "type": "object",
      "additionalProperties": false,
      "required": [
        "recordCount",
        "records"
      ],
      "properties": {
        "recordCount": {
          "type": "integer",
          "minimum": 0
        },
        "records": {
          "type": "array",
          "items": {
            "type": "object",
            "additionalProperties": true
          }
        },
        "sourceTool": {
          "type": "string"
        },
        "retrievedAt": {
          "type": "string",
          "format": "date-time"
        }
      }
    },
    "sourceRecord": {
      "type": "object",
      "additionalProperties": false,
      "required": [
        "name"
      ],
      "properties": {
        "name": {
          "type": "string"
        },
        "toolName": {
          "type": "string"
        },
        "url": {
          "type": "string",
          "format": "uri"
        },
        "retrievedAt": {
          "type": "string",
          "format": "date-time"
        },
        "citation": {
          "type": "string"
        }
      }
    },
    "provenance": {
      "type": "object",
      "additionalProperties": false,
      "required": [
        "sourceMcp",
        "generatedAt",
        "sources"
      ],
      "properties": {
        "sourceMcp": {
          "type": "string"
        },
        "generatedAt": {
          "type": "string",
          "format": "date-time"
        },
        "generatedBy": {
          "type": "string"
        },
        "traceId": {
          "type": "string"
        },
        "sources": {
          "type": "array",
          "minItems": 1,
          "items": {
            "$ref": "#/$defs/sourceRecord"
          }
        },
        "notes": {
          "type": "array",
          "items": {
            "type": "string"
          }
        }
      }
    }
  }
}
